{
  "$schema": "https://json-schema.org/draft/2020-12/schema",
  "$id": "urn:archolith:beacon:schema:cli-result:1.0",
  "title": "Beacon CLI Result 1.0",
  "type": "object",
  "additionalProperties": false,
  "required": [
    "schema",
    "schema_version",
    "command",
    "ok",
    "result",
    "diagnostics"
  ],
  "properties": {
    "schema": {
      "const": "beacon.cli-result"
    },
    "schema_version": {
      "const": "1.0"
    },
    "command": {
      "type": "string",
      "enum": [
        "init",
        "validate",
        "inspect",
        "export",
        "build"
      ]
    },
    "ok": {
      "type": "boolean"
    },
    "result": {
      "type": [
        "object",
        "null"
      ]
    },
    "diagnostics": {
      "type": "array",
      "items": {
        "$ref": "#/$defs/diagnostic"
      }
    }
  },
  "$defs": {
    "diagnostic": {
      "type": "object",
      "additionalProperties": false,
      "required": [
        "severity",
        "code",
        "message"
      ],
      "properties": {
        "severity": {
          "type": "string",
          "enum": [
            "info",
            "warning",
            "error"
          ]
        },
        "code": {
          "type": "string",
          "pattern": "^[a-z][a-z0-9_]{1,63}$"
        },
        "path": {
          "type": "string",
          "maxLength": 1024
        },
        "line": {
          "type": "integer",
          "minimum": 1
        },
        "message": {
          "type": "string",
          "minLength": 1,
          "maxLength": 4096
        },
        "acknowledged": {
          "type": "boolean",
          "default": false
        },
        "acknowledgement_reason": {
          "type": "string",
          "minLength": 10,
          "maxLength": 1024
        }
      },
      "allOf": [
        {
          "if": {
            "properties": {
              "acknowledged": {
                "const": true
              }
            },
            "required": [
              "acknowledged"
            ]
          },
          "then": {
            "required": [
              "acknowledgement_reason"
            ]
          }
        }
      ]
    }
  }
}
